{
  "$schema":"https://json-schema.org/draft/2020-12/schema",
  "title":"Vehicle RAG retrieval evaluation v1",
  "type":"object",
  "additionalProperties":false,
  "required":["schemaVersion","datasetVersion","knowledgeScopeId","cases"],
  "properties":{
    "schemaVersion":{"const":1},
    "datasetVersion":{"type":"string","minLength":1},
    "knowledgeScopeId":{"type":"string","minLength":1},
    "cases":{"type":"array","minItems":1,"items":{"type":"object","additionalProperties":false,"required":["caseId","query","expectedChunkIds"],"properties":{"caseId":{"type":"string","minLength":1},"query":{"type":"string","minLength":1},"expectedChunkIds":{"type":"array","minItems":1,"items":{"type":"string","minLength":1}}}}}
  }
}
