{
  "schemaVersion": 1,
  "datasetVersion": "model-y-2026-refresh-pdf-html-baseline-v2",
  "knowledgeScopeId": "model-y-2026-cn-2026-refresh-rwd",
  "cases": [
    {
      "caseId": "battery-and-drive-unit-warranty",
      "query": "电池和驱动电机有限质量保证",
      "expectedChunkIds": [
        "25ac79ff0d6327af8ebfcf5f1702f90a3ac3559e053157f1a45dca5af3a10b3b",
        "6bc9ffce226477f7c5da478376030200349b20eec074b3d94987d19b8866dd65"
      ]
    },
    {
      "caseId": "seatbelt-and-airbag-warranty",
      "query": "座椅安全带和气囊系统有限质量保证",
      "expectedChunkIds": [
        "8cc1566c1bbe04d2095179992f0027a92c69e50cb2b387f2503af51bc90148a1",
        "e0b388cb551b085f40af2f99570f33294e358b42e317c9096ae2e1c880240fac"
      ]
    },
    {
      "caseId": "basic-vehicle-warranty",
      "query": "车辆基本有限质量保证",
      "expectedChunkIds": [
        "62c230284b2f38a2855d1076c384504ca2a4e09868fcaaf750140e394603c391",
        "b697c1f23ce0d0fa2675455066d180c19b540eba53b9b711bb212d399cb229fa"
      ]
    },
    {
      "caseId": "front-passenger-airbag-for-child",
      "query": "儿童乘坐副驾驶座椅时，前排乘客安全气囊应处于什么状态？",
      "expectedChunkIds": [
        "7ebd0b984efb65978c9187d55af78f2a3313f8440cd4580ea888d6f5b0ec8653"
      ]
    },
    {
      "caseId": "remote-climate-control-in-app",
      "query": "如何通过 Tesla 手机应用启用或禁用暖气或空调，并查看驾驶室温度？",
      "expectedChunkIds": [
        "36d25ea1c55421e887bce9c15ce1d21632db4b8e618f707925947e84e1ad134f",
        "f90bc18f5bc1cedf4b0ffeb962cbcbdb94d8f71499ff1dabe4202458164e2a2b",
        "0f43eb8d6082ce706a751571b0008410661ffea9f73209a8f3d5d7d76a57cf56",
        "4935bd933b98f2cc156feef579c50922497bc26c4d691acbcaddf80149bbf282",
        "81b7078738e91a40a8a2c4ef36cf9c9ec91499deadbd38b078bb8d3b941ddd61"
      ]
    }
  ]
}
